slug,topic_slug,status,level,duration_hours,duration_sessions,title_vi,title_en,description_vi,description_en,tags,learning_outcome_vi,learning_outcome_en,price_original,price_sale,prerequisite,target_audience_vi,target_audience_en,modules_vi,modules_en,final_project_vi,final_project_en,delivery_format_vi,delivery_format_en,image_url
doe-process-optimization,quality-management,published,advanced,20,10,DoE for Process Optimization,DoE for Process Optimization,Kỹ thuật thiết kế thí nghiệm để tìm ra thông số vận hành tối ưu. Đặc biệt quan trọng khi thiết lập dây chuyền và cải tiến kỹ thuật.,Design of Experiment techniques to find optimal operating parameters. Especially important when setting up production lines and making technical improvements.,"DoE,thiết kế thí nghiệm,tối ưu hóa,thông số,kỹ thuật","Báo cáo tối ưu hóa thông số (nhiệt độ, áp suất, thời gian) để đạt chất lượng cao nhất.","A parameter optimization report (temperature, pressure, time) to achieve highest quality.",,,applied-spc,"Kỹ sư Nghiên cứu & Phát triển (R&D Engineers)|Kỹ sư Quy trình, Kỹ sư Hệ thống Công nghiệp|Chuyên gia Six Sigma (Black Belt/Green Belt)|Quản lý Kỹ thuật chịu trách nhiệm cài đặt thông số máy móc / dây chuyền","Kỹ sư Nghiên cứu & Phát triển (R&D Engineers)|Kỹ sư Quy trình, Kỹ sư Hệ thống Công nghiệp|Chuyên gia Six Sigma (Black Belt/Green Belt)|Quản lý Kỹ thuật chịu trách nhiệm cài đặt thông số máy móc / dây chuyền","Tổng quan về Thiết kế Thí nghiệm (DoE) Khái niệm cơ bản, so sánh với phương pháp thử-sai truyền thống (OFAT).|Thí nghiệm Giai thừa (Factorial Designs) Cách thiết lập thí nghiệm 2^k Full Factorial và Fractional Factorial.|Phân tích Phương sai (ANOVA) Sử dụng công cụ toán học để đọc hiểu kết quả tác động của các nhân tố.|Phương pháp Bề mặt Đáp ứng (Response Surface Methodology) Tinh chỉnh thiết kế để tìm điểm tối ưu tuyệt đối của quy trình.|Dự án cuối khóa Thực hiện một dự án tối ưu hóa đa biến thực tế.","Tổng quan về Thiết kế Thí nghiệm (DoE) Khái niệm cơ bản, so sánh với phương pháp thử-sai truyền thống (OFAT).|Thí nghiệm Giai thừa (Factorial Designs) Cách thiết lập thí nghiệm 2^k Full Factorial và Fractional Factorial.|Phân tích Phương sai (ANOVA) Sử dụng công cụ toán học để đọc hiểu kết quả tác động của các nhân tố.|Phương pháp Bề mặt Đáp ứng (Response Surface Methodology) Tinh chỉnh thiết kế để tìm điểm tối ưu tuyệt đối của quy trình.|Dự án cuối khóa Thực hiện một dự án tối ưu hóa đa biến thực tế.",Bạn sẽ giải quyết một bài toán đau đầu về chất lượng thông qua việc: - Chọn ít nhất 3 biến số đầu vào (Inputs) cần tối ưu - Thiết kế ma trận thí nghiệm trên Minitab,Bạn sẽ giải quyết một bài toán đau đầu về chất lượng thông qua việc: - Chọn ít nhất 3 biến số đầu vào (Inputs) cần tối ưu - Thiết kế ma trận thí nghiệm trên Minitab,Online / Hybrid,Online / Hybrid,/images/courses/doe-process-optimization.jpg
quality-4-strategy,quality-management,published,strategic,20,10,Quality 4.0 Strategy,Quality 4.0 Strategy,Tích hợp AI và IoT vào hệ thống quản lý chất lượng. Chuyển từ phòng ngừa sang dự báo chất lượng thông minh (Predictive Quality).,Integrate AI and IoT into quality management systems. Shift from prevention to intelligent Predictive Quality.,"Quality 4.0,AI,IoT,predictive quality,QA/QC,chuyển đổi số",Đề án chuyển đổi số cho bộ phận Quản lý chất lượng (QA/QC).,A digital transformation proposal for the Quality Management (QA/QC) department.,,,,"Giám đốc Chất lượng (CQO), Trưởng phòng QA/QC|Lãnh đạo cấp cao phụ trách Vận hành và Chuyển đổi số|Quản lý Dự án số hóa chuỗi cung ứng và nhà máy|Chuyên gia Cải tiến Hệ thống (System Auditors)","Giám đốc Chất lượng (CQO), Trưởng phòng QA/QC|Lãnh đạo cấp cao phụ trách Vận hành và Chuyển đổi số|Quản lý Dự án số hóa chuỗi cung ứng và nhà máy|Chuyên gia Cải tiến Hệ thống (System Auditors)","Khung Kiến trúc Quality 4.0 Định nghĩa, sự khác biệt so với QA/QC truyền thống, và hệ sinh thái công nghệ số.|Kết nối Dữ liệu Chất lượng với IoT & AI Camera Cách tự động hóa việc thu thập dữ liệu bằng cảm biến và thị giác máy tính thay cho mắt người.|Dự báo Chất lượng (Predictive Quality) Nguyên lý dùng Machine Learning để cảnh báo các lô hàng lỗi trước khi xuất xưởng.|Quản trị sự thay đổi số trong QA/QC Đào tạo đội ngũ, vượt qua sức ỳ và xây dựng văn hóa ""Chất lượng dựa trên dữ liệu"".|Dự án cuối khóa Hoạch định chiến lược chuyển đổi số cho bộ phận chất lượng.","Khung Kiến trúc Quality 4.0 Định nghĩa, sự khác biệt so với QA/QC truyền thống, và hệ sinh thái công nghệ số.|Kết nối Dữ liệu Chất lượng với IoT & AI Camera Cách tự động hóa việc thu thập dữ liệu bằng cảm biến và thị giác máy tính thay cho mắt người.|Dự báo Chất lượng (Predictive Quality) Nguyên lý dùng Machine Learning để cảnh báo các lô hàng lỗi trước khi xuất xưởng.|Quản trị sự thay đổi số trong QA/QC Đào tạo đội ngũ, vượt qua sức ỳ và xây dựng văn hóa ""Chất lượng dựa trên dữ liệu"".|Dự án cuối khóa Hoạch định chiến lược chuyển đổi số cho bộ phận chất lượng.",Bạn sẽ đóng vai trò là Giám đốc Dự án Chuyển đổi số để: - Đánh giá hiện trạng kiểm soát chất lượng tại công ty - Lựa chọn giải pháp công nghệ (IoT/AI) phù hợp giải quyết các nút thắt,Bạn sẽ đóng vai trò là Giám đốc Dự án Chuyển đổi số để: - Đánh giá hiện trạng kiểm soát chất lượng tại công ty - Lựa chọn giải pháp công nghệ (IoT/AI) phù hợp giải quyết các nút thắt,Online / Hybrid,Online / Hybrid,/images/courses/quality-4-strategy.jpg
inventory-masterclass,operations-optimization,published,foundation,16,8,Inventory Masterclass,Inventory Masterclass,Tối ưu hóa dòng vốn nằm trong kho. Học cách thiết lập điểm đặt hàng lại (Reorder Point) và mức tồn kho an toàn để không bao giờ mất đơn hàng do thiếu hàng.,Optimize capital flow held in inventory. Learn how to set Reorder Points and safety stock levels to never lose orders due to stockouts.,"tồn kho,reorder point,safety stock,SKU,kho bãi",Một file Dashboard quản lý và tối ưu tồn kho cho ít nhất 100 SKUs.,A Dashboard file to manage and optimize inventory for at least 100 SKUs.,,,,"Nhân viên và quản lý kho vận, thu mua|Chuyên viên lập kế hoạch nhu cầu (Demand Planners)|Quản lý tài chính muốn tối ưu hóa vốn lưu động|Chủ doanh nghiệp SME muốn kiểm soát thất thoát và tồn kho ảo","Nhân viên và quản lý kho vận, thu mua|Chuyên viên lập kế hoạch nhu cầu (Demand Planners)|Quản lý tài chính muốn tối ưu hóa vốn lưu động|Chủ doanh nghiệp SME muốn kiểm soát thất thoát và tồn kho ảo","Bản chất của Tồn kho và các loại Chi phí Thấu hiểu sự đánh đổi giữa chi phí đặt hàng, chi phí lưu kho và chi phí thiếu hàng|Kỹ thuật Phân loại và Dự báo Nhu cầu Áp dụng mô hình ABC/XYZ và các phương pháp dự báo cơ bản trên Excel.|Các mô hình Quản trị Tồn kho phổ biến Thực hành mô hình EOQ, POQ và quản lý tồn kho cho hàng hóa theo mùa vụ.|Thiết lập Hệ thống Kiểm soát Tồn kho Xây dựng logic tự động cảnh báo nhập hàng và kiểm soát sai lệch kho.|Dự án cuối khóa Xây dựng hệ thống Dashboard quản trị tồn kho thực tế.","Bản chất của Tồn kho và các loại Chi phí Thấu hiểu sự đánh đổi giữa chi phí đặt hàng, chi phí lưu kho và chi phí thiếu hàng|Kỹ thuật Phân loại và Dự báo Nhu cầu Áp dụng mô hình ABC/XYZ và các phương pháp dự báo cơ bản trên Excel.|Các mô hình Quản trị Tồn kho phổ biến Thực hành mô hình EOQ, POQ và quản lý tồn kho cho hàng hóa theo mùa vụ.|Thiết lập Hệ thống Kiểm soát Tồn kho Xây dựng logic tự động cảnh báo nhập hàng và kiểm soát sai lệch kho.|Dự án cuối khóa Xây dựng hệ thống Dashboard quản trị tồn kho thực tế.",Bạn sẽ sử dụng bộ dữ liệu kinh doanh thực tế để: - Phân tích hiện trạng tồn kho của ít nhất 100 mã hàng (SKUs) - Tính toán các thông số đặt hàng tối ưu,Bạn sẽ sử dụng bộ dữ liệu kinh doanh thực tế để: - Phân tích hiện trạng tồn kho của ít nhất 100 mã hàng (SKUs) - Tính toán các thông số đặt hàng tối ưu,Online / Hybrid,Online / Hybrid,/images/courses/inventory-masterclass.jpg
routing-fleet-ops,operations-optimization,published,tools,16,8,Routing & Fleet Ops,Routing & Fleet Ops,Cắt giảm 15-20% chi phí vận tải thông qua sắp xếp lộ trình thông minh. Ứng dụng các thuật toán đơn giản để quản lý đội xe và tải trọng hiệu quả.,Cut 15-20% transportation costs through intelligent route planning. Apply simple algorithms to manage fleet and load efficiently.,"routing,vận tải,đội xe,tối ưu lộ trình,logistics",Bản kế hoạch điều xe tối ưu cho một mạng lưới giao nhận thực tế.,An optimized vehicle dispatch plan for a real delivery network.,,,,,,,,Bạn sẽ làm việc trên một mạng lưới giao hàng thực tế để: - Phân tích dữ liệu vận tải hiện tại. - Thiết kế lại lộ trình giao hàng để giảm quãng đường và chi phí.,Bạn sẽ làm việc trên một mạng lưới giao hàng thực tế để: - Phân tích dữ liệu vận tải hiện tại. - Thiết kế lại lộ trình giao hàng để giảm quãng đường và chi phí.,Online / Hybrid,Online / Hybrid,/images/courses/routing-fleet-ops.jpg
warehouse-flow-design,operations-optimization,published,application,20,10,Warehouse Flow Design,Warehouse Flow Design,Tăng 30% tốc độ lấy hàng (Picking) bằng cách sắp xếp lại vị trí hàng hóa và luồng di chuyển. Học cách vẽ lại mặt bằng kho thông minh.,Increase picking speed by 30% by reorganizing product locations and movement flow. Learn how to redesign an intelligent warehouse layout.,"kho bãi,layout,picking,material flow,warehouse design",Bản thiết kế Layout kho tối ưu hóa không gian và luồng di chuyển (Material Flow).,A warehouse Layout design that optimizes space and Material Flow.,,,,,,,,Bạn sẽ nhận bản vẽ mặt bằng của một nhà kho thực tế để: - Đo lường và đánh giá thời gian thao tác lấy hàng hiện tại. - Tái cấu trúc lại vị trí kệ hàng và khu vực xuất/nhập.,Bạn sẽ nhận bản vẽ mặt bằng của một nhà kho thực tế để: - Đo lường và đánh giá thời gian thao tác lấy hàng hiện tại. - Tái cấu trúc lại vị trí kệ hàng và khu vực xuất/nhập.,Online / Hybrid,Online / Hybrid,/images/courses/warehouse-flow-design.jpg
supply-chain-network-design,operations-optimization,published,advanced,24,12,Supply Chain Network Design,Supply Chain Network Design,Thiết kế bản đồ logistics cho toàn doanh nghiệp. Trả lời câu hỏi chiến lược về vị trí kho bãi và trung tâm phân phối để giảm chi phí tổng thể.,Design a logistics map for the entire organization. Answer strategic questions about warehouse locations and distribution centers to reduce overall costs.,"network design,phân phối,kho bãi,chiến lược,GIS",Đề án xác định vị trí kho tối ưu dựa trên dữ liệu địa lý và chi phí.,A proposal for optimal warehouse location based on geographic and cost data.,,,,,,,,Bạn sẽ đóng vai trò chuyên gia tư vấn để: - Phân tích mạng lưới hiện tại của một doanh nghiệp. - Đề xuất các vị trí kho mới dựa trên trọng tâm nhu cầu.,Bạn sẽ đóng vai trò chuyên gia tư vấn để: - Phân tích mạng lưới hiện tại của một doanh nghiệp. - Đề xuất các vị trí kho mới dựa trên trọng tâm nhu cầu.,Online / Hybrid,Online / Hybrid,/images/courses/supply-chain-network-design.jpg
simulation-decision-support,operations-optimization,published,strategic,24,12,Simulation & Decision Support,Simulation & Decision Support,Đỉnh cao của tối ưu hóa. Sử dụng mô phỏng (AnyLogic/Arena) để dự đoán nút thắt cổ chai và thử nghiệm thay đổi mà không gây rủi ro cho vận hành thực.,The pinnacle of optimization. Use simulation (AnyLogic/Arena) to predict bottlenecks and test changes without risking real operations.,"simulation,AnyLogic,Arena,bottleneck,mô phỏng,decision support",Mô hình mô phỏng hoàn chỉnh cho một dây chuyền hoặc hệ thống Logistics.,A complete simulation model for a production line or Logistics system.,,,supply-chain-network-design,,,,,"- Xây dựng bản sao vận hành ảo của một kho hàng hoặc dây chuyền. - Tìm ra cấu hình nguồn lực (nhân sự, xe nâng, máy móc) tối ưu nhất.","- Xây dựng bản sao vận hành ảo của một kho hàng hoặc dây chuyền. - Tìm ra cấu hình nguồn lực (nhân sự, xe nâng, máy móc) tối ưu nhất.",Online / Hybrid,Online / Hybrid,/images/courses/simulation-decision-support.jpg
logistics-dashboarding,data-analytics-digital-scm,published,foundation,16,8,Logistics Dashboarding,Logistics Dashboarding,Biến những bảng tính Excel rời rạc thành hệ thống báo cáo tự động trên Power BI. Giúp nhà quản lý nắm bắt tình hình kho vận chỉ trong 3 giây nhìn màn hình.,Transform scattered Excel spreadsheets into an automated reporting system on Power BI. Help managers grasp warehouse and logistics status in just 3 seconds.,"Power BI,dashboard,KPI,Excel,báo cáo",Một hệ thống Dashboard báo cáo KPI thực tế của doanh nghiệp.,A live KPI reporting Dashboard system for the organization.,,,,,,,,Bạn sẽ làm việc trên bộ dữ liệu vận hành thực tế của doanh nghiệp để: - Làm sạch và cấu trúc lại dữ liệu rời rạc. - Thiết kế bộ chỉ số KPI đo lường hiệu suất kho vận/vận tải.,Bạn sẽ làm việc trên bộ dữ liệu vận hành thực tế của doanh nghiệp để: - Làm sạch và cấu trúc lại dữ liệu rời rạc. - Thiết kế bộ chỉ số KPI đo lường hiệu suất kho vận/vận tải.,Online / Hybrid,Online / Hybrid,/images/courses/logistics-dashboarding.jpg
sql-for-supply-chain,data-analytics-digital-scm,published,tools,16,8,SQL for Supply Chain,SQL for Supply Chain,Phá vỡ rào cản giữa 'Dân vận hành' và 'Dân IT'. Học viên làm chủ kỹ năng trích xuất dữ liệu thô từ hệ thống ERP/WMS để phục vụ các phân tích chuyên sâu.,Break the barrier between 'Operations People' and 'IT People'. Students master the skill of extracting raw data from ERP/WMS systems for in-depth analysis.,"SQL,ERP,WMS,dữ liệu,truy vấn,database",Khả năng tự viết câu lệnh lấy dữ liệu từ ERP/WMS mà không cần hỗ trợ từ IT.,The ability to write your own data queries from ERP/WMS without IT support.,,,logistics-dashboarding,,,,,- Khả năng tự viết câu lệnh trích xuất dữ liệu từ hệ thống ERP/WMS để phục vụ báo cáo mà không cần IT. - Tự động hóa việc trích xuất dữ liệu và lập báo cáo định kỳ,- Khả năng tự viết câu lệnh trích xuất dữ liệu từ hệ thống ERP/WMS để phục vụ báo cáo mà không cần IT. - Tự động hóa việc trích xuất dữ liệu và lập báo cáo định kỳ,Online / Hybrid,Online / Hybrid,/images/courses/sql-for-supply-chain.jpg
advanced-demand-planning,data-analytics-digital-scm,published,application,20,10,Advanced Demand Planning,Advanced Demand Planning,Dự báo nhu cầu chính xác hơn để giảm tồn kho thừa và tránh cháy hàng. Tập trung vào xử lý dữ liệu lịch sử và biến động thị trường.,Forecast demand more accurately to reduce excess inventory and avoid stockouts. Focus on processing historical data and market fluctuations.,"demand planning,forecasting,dự báo,tồn kho,mua hàng",Mô hình dự báo nhu cầu (Forecasting Model) ứng dụng vào kế hoạch mua hàng.,A Demand Forecasting Model applied to procurement planning.,,,sql-for-supply-chain,,,,,- Một mô hình dự báo nhu cầu (Forecasting Model) ứng dụng trực tiếp vào kế hoạch mua hàng và sản xuất. - Kế hoạch sản xuất tổng dựa trên kết quả dự báo và dữ liệu đầu vào sản xuất,- Một mô hình dự báo nhu cầu (Forecasting Model) ứng dụng trực tiếp vào kế hoạch mua hàng và sản xuất. - Kế hoạch sản xuất tổng dựa trên kết quả dự báo và dữ liệu đầu vào sản xuất,Online / Hybrid,Online / Hybrid,/images/courses/advanced-demand-planning.jpg
digital-twin-foundation,data-analytics-digital-scm,published,advanced,24,12,Digital Twin Foundation,Digital Twin Foundation,Xây dựng 'Bản sao số' để theo dõi toàn cảnh chuỗi cung ứng. Giúp nhận diện rủi ro tiềm ẩn tại bất kỳ mắt xích nào từ nhà cung cấp đến khách hàng.,Build a 'Digital Replica' to monitor the entire supply chain. Identify potential risks at any link from supplier to customer.,"digital twin,bản sao số,supply chain,rủi ro,data flow",Sơ đồ dòng chảy dữ liệu (Data Flow) xuyên suốt chuỗi cung ứng số.,A Data Flow diagram throughout the digital supply chain.,,,advanced-demand-planning,,,,,,,Online / Hybrid,Online / Hybrid,/images/courses/digital-twin-foundation.jpg
digital-transformation-roadmap,data-analytics-digital-scm,published,strategic,20,10,Digital Transformation Roadmap,Digital Transformation Roadmap,"Hoạch định chiến lược đầu tư công nghệ. Giúp lãnh đạo chọn đúng công cụ, đúng thời điểm để tránh lãng phí tiền bạc vào các dự án số hóa thất bại.",Plan technology investment strategy. Help leaders choose the right tools at the right time to avoid wasting money on failed digitalization projects.,"chuyển đổi số,roadmap,chiến lược,công nghệ,lãnh đạo",Bản lộ trình (Roadmap) chuyển đổi số chi tiết cho đơn vị hoặc công ty.,A detailed Digital Transformation Roadmap for the department or company.,,,,,,,,,,Online / Hybrid,Online / Hybrid,/images/courses/digital-transformation-roadmap.jpg
customs-trade-practice,compliance-legal,published,foundation,16,8,Customs & Trade Practice,Customs & Trade Practice,"Làm chủ nghiệp vụ Hải quan thực chiến. Học viên biết cách kiểm soát hồ sơ, áp mã thuế đúng và tự tin làm việc với cơ quan chức năng.","Master practical customs operations. Students learn how to manage documentation, apply correct tariff codes and confidently work with authorities.","hải quan,xuất nhập khẩu,thuế quan,mã HS,thủ tục",Bộ quy trình tự kiểm tra (Checklist) hồ sơ xuất nhập khẩu chuẩn chỉnh.,A self-inspection Checklist for standard import/export documentation.,,,,,,,,- Hoàn thiện một bộ hồ sơ thông quan thực tế phức tạp và xây dựng Checklist chuẩn hóa cho công ty. - **Sản phẩm mẫu** - Bộ quy trình tự kiểm tra (Checklist) hồ sơ xuất nhập khẩu chuẩn chỉnh.,- Hoàn thiện một bộ hồ sơ thông quan thực tế phức tạp và xây dựng Checklist chuẩn hóa cho công ty. - **Sản phẩm mẫu** - Bộ quy trình tự kiểm tra (Checklist) hồ sơ xuất nhập khẩu chuẩn chỉnh.,Online / Hybrid,Online / Hybrid,/images/courses/customs-trade-practice.jpg
operations-standards-iso,compliance-legal,published,tools,20,10,Operations Standards (ISO),Operations Standards (ISO),Xây dựng nền tảng vận hành chuẩn quốc tế. Giúp doanh nghiệp luôn ở trạng thái sẵn sàng đánh giá từ các khách hàng lớn và tổ chức chứng nhận.,Build an internationally standardized operational foundation. Help organizations stay ready for audits from major customers and certification bodies.,"ISO,tiêu chuẩn,chứng nhận,vận hành,an toàn môi trường",Kế hoạch triển khai và duy trì hệ thống quản lý ISO tại đơn vị.,A plan to implement and maintain an ISO management system at your organization.,,,,,,,,- Thiết kế khung quy trình vận hành và kế hoạch duy trì chứng nhận ISO cho bộ phận kho/vận tải. - **Sản phẩm mẫu** - Kế hoạch triển khai và duy trì hệ thống quản lý ISO tại đơn vị.,- Thiết kế khung quy trình vận hành và kế hoạch duy trì chứng nhận ISO cho bộ phận kho/vận tải. - **Sản phẩm mẫu** - Kế hoạch triển khai và duy trì hệ thống quản lý ISO tại đơn vị.,Online / Hybrid,Online / Hybrid,/images/courses/operations-standards-iso.jpg
fta-rules-of-origin-master,compliance-legal,published,application,20,10,FTA & Rules of Origin Master,FTA & Rules of Origin Master,Biết cách thiết lập chuỗi cung ứng đáp ứng quy tắc xuất xứ để hưởng lợi ích tối đa từ các hiệp định thương mại tự do.,Learn how to establish a supply chain that meets rules of origin to maximize benefits from free trade agreements.,"FTA,quy tắc xuất xứ,thuế quan ưu đãi,thương mại tự do,C/O",Bản phân tích khả năng tận dụng FTA cho danh mục sản phẩm của công ty.,An analysis of your company's ability to leverage FTAs for its product portfolio.,,,customs-trade-practice,,,,,- Xây dựng báo cáo chiến lược: Đánh giá khả năng tận dụng FTA để xuất khẩu một mặt hàng chủ lực sang thị trường EU/Mỹ. - **Sản phẩm mẫu** - Bản phân tích khả năng tận dụng FTA cho danh mục sản phẩm của công ty.,- Xây dựng báo cáo chiến lược: Đánh giá khả năng tận dụng FTA để xuất khẩu một mặt hàng chủ lực sang thị trường EU/Mỹ. - **Sản phẩm mẫu** - Bản phân tích khả năng tận dụng FTA cho danh mục sản phẩm của công ty.,Online / Hybrid,Online / Hybrid,/images/courses/fta-rules-of-origin-master.jpg
legal-risk-in-logistics,compliance-legal,published,advanced,20,10,Legal Risk in Logistics,Legal Risk in Logistics,"Kỹ thuật soạn thảo hợp đồng và xử lý khủng hoảng pháp lý. Tập trung vào bảo vệ quyền lợi doanh nghiệp khi có sự cố hư hỏng, mất mát hàng hóa.",Contract drafting and legal crisis management techniques. Focus on protecting business interests when goods are damaged or lost.,"hợp đồng,pháp lý,rủi ro,khiếu nại,logistics law",Mẫu hợp đồng Logistics và quy trình xử lý khiếu nại (Claim) tiêu chuẩn.,A standard Logistics contract template and Claim handling procedure.,,,,,,,,- Xây dựng một bản hợp đồng cung cấp dịch vụ Logistics hoàn chỉnh và bộ quy trình phản ứng khi có tổn thất hàng hóa. - **Sản phẩm mẫu** - Mẫu hợp đồng Logistics tiêu chuẩn và quy trình xử lý khiếu nại (Claim).,- Xây dựng một bản hợp đồng cung cấp dịch vụ Logistics hoàn chỉnh và bộ quy trình phản ứng khi có tổn thất hàng hóa. - **Sản phẩm mẫu** - Mẫu hợp đồng Logistics tiêu chuẩn và quy trình xử lý khiếu nại (Claim).,Online / Hybrid,Online / Hybrid,/images/courses/legal-risk-in-logistics.jpg
