slug,topic_slug,status,level,duration_hours,duration_sessions,title_vi,title_en,description_vi,description_en,tags,learning_outcome_vi,learning_outcome_en,price_original,price_sale,prerequisite,target_audience_vi,target_audience_en,modules_vi,modules_en,final_project_vi,final_project_en,delivery_format_vi,delivery_format_en,image_url
integrity-digital-compliance,compliance-legal,published,strategic,20,10,Integrity & Digital Compliance,Integrity & Digital Compliance,Quản trị sự minh bạch và bảo mật trong chuỗi cung ứng số. Đáp ứng các yêu cầu khắt khe về đạo đức kinh doanh của thị trường quốc tế.,Manage transparency and security in the digital supply chain. Meet stringent business ethics requirements of international markets.,"tuân thủ số,bảo mật dữ liệu,đạo đức kinh doanh,minh bạch,ESG",Bản dự thảo 'Chính sách tuân thủ nội bộ' và quy trình bảo mật dữ liệu số.,A draft 'Internal Compliance Policy' and digital data security procedure.,,,,,,,,"- Lập khung rà soát và đánh giá tuân thủ rủi ro số cho một mạng lưới đối tác cung ứng. - **Sản phẩm mẫu** - Bản dự thảo ""Chính sách tuân thủ nội bộ"" và quy trình bảo mật dữ liệu số.","- Lập khung rà soát và đánh giá tuân thủ rủi ro số cho một mạng lưới đối tác cung ứng. - **Sản phẩm mẫu** - Bản dự thảo ""Chính sách tuân thủ nội bộ"" và quy trình bảo mật dữ liệu số.",Online / Hybrid,Online / Hybrid,/images/courses/integrity-digital-compliance.jpg
industrial-iot-sensors,iot-computer-vision,published,foundation,16,8,Industrial IoT & Sensors,Industrial IoT & Sensors,Nền tảng về 'giác quan' của máy móc. Học cách kết nối vạn vật trong nhà máy và kho bãi để dữ liệu luôn chảy về trung tâm một cách tự động.,Fundamentals of machine 'senses'. Learn how to connect everything in factories and warehouses so data flows to a central hub automatically.,"IoT,cảm biến,nhà máy thông minh,kết nối,sensor map",Một bản thiết kế hệ thống cảm biến (Sensor Map) cho một khu vực vận hành cụ thể.,A Sensor Map design for a specific operational area.,,,,,,,,- Quy hoạch và vẽ sơ đồ lắp đặt cảm biến để giải quyết một bài toán mù thông tin tại phân xưởng/kho hàng. - **Sản phẩm mẫu** - Một bản thiết kế hệ thống cảm biến (Sensor Map) cho một khu vực vận hành cụ thể.,- Quy hoạch và vẽ sơ đồ lắp đặt cảm biến để giải quyết một bài toán mù thông tin tại phân xưởng/kho hàng. - **Sản phẩm mẫu** - Một bản thiết kế hệ thống cảm biến (Sensor Map) cho một khu vực vận hành cụ thể.,Online / Hybrid,Online / Hybrid,/images/courses/industrial-iot-sensors.jpg
computer-vision-in-ops,iot-computer-vision,published,tools,20,10,Computer Vision in Ops,Computer Vision in Ops,"Ứng dụng AI Camera để thay thế mắt người trong các tác vụ lặp đi lặp lại: đếm hàng, phân loại sản phẩm và giám sát an toàn 24/7.","Apply AI Cameras to replace human eyes in repetitive tasks: counting goods, classifying products and 24/7 safety monitoring.","computer vision,AI camera,phân loại,giám sát,an toàn lao động",Đề án ứng dụng Camera thông minh để giải quyết 01 vấn đề giám sát thực tế.,A proposal for applying smart Cameras to solve 01 real monitoring problem.,,,industrial-iot-sensors,,,,,- Lập đề án kỹ thuật triển khai hệ thống Camera AI để khắc phục một điểm yếu về giám sát tại nơi làm việc. - **Sản phẩm mẫu** - Đề án ứng dụng Camera thông minh để giải quyết 01 vấn đề giám sát thực tế.,- Lập đề án kỹ thuật triển khai hệ thống Camera AI để khắc phục một điểm yếu về giám sát tại nơi làm việc. - **Sản phẩm mẫu** - Đề án ứng dụng Camera thông minh để giải quyết 01 vấn đề giám sát thực tế.,Online / Hybrid,Online / Hybrid,/images/courses/computer-vision-in-ops.jpg
realtime-monitoring-systems,iot-computer-vision,published,application,20,10,Real-time Monitoring Systems,Real-time Monitoring Systems,Xây dựng hệ thống 'phản ứng nhanh'. Dữ liệu từ cảm biến được hiển thị tức thì trên điện thoại/máy tính để can thiệp kịp thời khi có sự cố.,Build a 'rapid response' system. Sensor data is displayed instantly on phone/computer to intervene promptly when incidents occur.,"real-time,monitoring,dashboard,cảnh báo,IoT",Một Dashboard giám sát thời gian thực (Real-time) kết nối với thiết bị giả lập/thực tế.,A Real-time monitoring Dashboard connected to simulated/actual devices.,,,computer-vision-in-ops,,,,,- Hoàn thiện một bảng điều khiển giám sát kết nối với luồng dữ liệu liên tục và có tính năng tự động phát cảnh báo. - **Sản phẩm mẫu** - Một Dashboard giám sát thời gian thực (Real-time) kết nối với thiết bị giả lập/thực tế.,- Hoàn thiện một bảng điều khiển giám sát kết nối với luồng dữ liệu liên tục và có tính năng tự động phát cảnh báo. - **Sản phẩm mẫu** - Một Dashboard giám sát thời gian thực (Real-time) kết nối với thiết bị giả lập/thực tế.,Online / Hybrid,Online / Hybrid,/images/courses/realtime-monitoring-systems.jpg
predictive-maintenance-aiot,iot-computer-vision,published,advanced,24,12,Predictive Maintenance (AIoT),Predictive Maintenance (AIoT),"Chuyển từ 'Hỏng mới sửa' sang 'Biết trước để ngừa'. Sử dụng dữ liệu IoT để dự đoán tuổi thọ linh kiện, giúp giảm 50% thời gian dừng máy đột ngột.","Shift from 'Fix when broken' to 'Know ahead to prevent'. Use IoT data to predict component lifespan, helping reduce unexpected downtime by 50%.","predictive maintenance,AIoT,bảo trì,dự đoán,downtime",Kế hoạch bảo trì dự báo (Predictive Maintenance Plan) dựa trên dữ liệu cảm biến.,A Predictive Maintenance Plan based on sensor data.,,,realtime-monitoring-systems,,,,,- Phân tích tập dữ liệu lịch sử của một động cơ/hệ thống xe và lập lịch bảo trì dự báo giúp giảm chi phí Downtime. - **Sample Output (Demo) (Sản phẩm mẫu)** - Kế hoạch bảo trì dự báo (Predictive Maintenance Plan) dựa trên dữ liệu cảm biến.,- Phân tích tập dữ liệu lịch sử của một động cơ/hệ thống xe và lập lịch bảo trì dự báo giúp giảm chi phí Downtime. - **Sample Output (Demo) (Sản phẩm mẫu)** - Kế hoạch bảo trì dự báo (Predictive Maintenance Plan) dựa trên dữ liệu cảm biến.,Online / Hybrid,Online / Hybrid,/images/courses/predictive-maintenance-aiot.jpg
aiot-strategic-roadmap,iot-computer-vision,published,strategic,20,10,AIoT Strategic Roadmap,AIoT Strategic Roadmap,"Tầm nhìn chiến lược về kết nối thông minh. Cách lựa chọn công nghệ, đảm bảo an ninh mạng và tích hợp toàn bộ dữ liệu hiện trường vào bộ não của doanh nghiệp.","Strategic vision for smart connectivity. How to select technology, ensure cybersecurity and integrate all field data into the organization's intelligence hub.","AIoT,roadmap,an ninh mạng,hạ tầng IoT,chiến lược số",Bản lộ trình (Roadmap) triển khai hạ tầng IoT/Vision toàn diện cho doanh nghiệp.,A comprehensive IoT/Vision infrastructure deployment Roadmap for the organization.,,,,,,,,- Hoàn thành bản thuyết trình chiến lược đầu tư công nghệ AIoT trình ban giám đốc. - **Sản phẩm mẫu** - Bản lộ trình (Roadmap) triển khai hạ tầng IoT/Vision toàn diện cho doanh nghiệp.,- Hoàn thành bản thuyết trình chiến lược đầu tư công nghệ AIoT trình ban giám đốc. - **Sản phẩm mẫu** - Bản lộ trình (Roadmap) triển khai hạ tầng IoT/Vision toàn diện cho doanh nghiệp.,Online / Hybrid,Online / Hybrid,/images/courses/aiot-strategic-roadmap.jpg
technical-presentation-excellence,professional-skills,published,foundation,12,6,Technical Presentation Excellence,Technical Presentation Excellence,Biến số liệu khô khan thành câu chuyện thuyết phục. Tập trung vào kỹ thuật kể chuyện bằng dữ liệu (Data Storytelling) dành riêng cho báo cáo vận hành.,Turn dry numbers into compelling stories. Focus on Data Storytelling techniques specifically for operational reports.,"presentation,data storytelling,báo cáo,slide,thuyết trình",Một bộ Slide báo cáo chuyên môn đạt chuẩn 'Executive Ready'.,A professional report Slide deck meeting 'Executive Ready' standards.,,,,,,,,,,Online / Hybrid,Online / Hybrid,/images/courses/technical-presentation-excellence.jpg
structural-problem-solving,professional-skills,published,tools,12,6,Structural Problem Solving,Structural Problem Solving,"Làm chủ các phương pháp tư duy có hệ thống để bóc tách các vấn đề hóc búa trong doanh nghiệp. Không giải quyết phần ngọn, tập trung vào căn nguyên.",Master systematic thinking methods to break down complex business problems. Don't solve symptoms — focus on root causes.,"problem solving,root cause,tư duy hệ thống,action plan,phân tích",Ma trận giải quyết vấn đề và kế hoạch hành động khắc phục (Action Plan).,A problem-solving matrix and corrective Action Plan.,,,,,,,,"- Phân tích một sự cố thực tế (VD: Chậm giao hàng, tỷ lệ lỗi sản phẩm tăng) và lập ma trận giải quyết toàn diện. - **Sản phẩm mẫu** - Ma trận giải quyết vấn đề và kế hoạch hành động khắc phục (Action Plan).","- Phân tích một sự cố thực tế (VD: Chậm giao hàng, tỷ lệ lỗi sản phẩm tăng) và lập ma trận giải quyết toàn diện. - **Sản phẩm mẫu** - Ma trận giải quyết vấn đề và kế hoạch hành động khắc phục (Action Plan).",Online / Hybrid,Online / Hybrid,/images/courses/structural-problem-solving.jpg
project-execution-for-engineers,professional-skills,published,application,16,8,Project Execution for Engineers,Project Execution for Engineers,"Kỹ năng điều phối dự án cải tiến. Học viên biết cách kiểm soát tiến độ, quản lý nhà thầu và các bên liên quan để dự án không bị 'vỡ trận'.","Project coordination skills for improvement initiatives. Students learn how to control progress, manage contractors and stakeholders so projects stay on track.","project management,Gantt,tiến độ,nhà thầu,rủi ro dự án",Biểu đồ Gantt và bảng quản trị rủi ro cho một dự án thực tế tại công ty.,A Gantt chart and risk management table for a real company project.,,,,,,,,"- Thiết lập một bộ hồ sơ quản trị dự án (Project Charter, Gantt Chart, Risk Matrix) cho một dự án cải tiến thực tế tại công ty. - **Sản phẩm mẫu** - Biểu đồ Gantt và bảng quản trị rủi ro cho một dự án thực tế tại công ty.","- Thiết lập một bộ hồ sơ quản trị dự án (Project Charter, Gantt Chart, Risk Matrix) cho một dự án cải tiến thực tế tại công ty. - **Sản phẩm mẫu** - Biểu đồ Gantt và bảng quản trị rủi ro cho một dự án thực tế tại công ty.",Online / Hybrid,Online / Hybrid,/images/courses/project-execution-for-engineers.jpg
operational-leadership,professional-skills,published,advanced,16,8,Operational Leadership,Operational Leadership,"Kỹ năng quản lý nhân sự tại hiện trường. Tập trung vào việc tạo động lực cho nhân viên cấp dưới, quản lý hiệu suất và dẫn dắt sự thay đổi.","On-site personnel management skills. Focus on motivating subordinates, managing performance and leading change.","leadership,quản lý nhân sự,hiệu suất,động lực,change management",Kỹ năng xử lý 10 tình huống xung đột nhân sự điển hình.,Skills to handle 10 typical personnel conflict scenarios.,,,,,,,,- Đóng vai (Role-play) xử lý trực tiếp một ca xung đột gay gắt giữa nhân viên và quản lý. - **Sản phẩm mẫu** - Bộ cẩm nang: Kỹ năng xử lý 10 tình huống xung đột nhân sự điển hình.,- Đóng vai (Role-play) xử lý trực tiếp một ca xung đột gay gắt giữa nhân viên và quản lý. - **Sản phẩm mẫu** - Bộ cẩm nang: Kỹ năng xử lý 10 tình huống xung đột nhân sự điển hình.,Online / Hybrid,Online / Hybrid,/images/courses/operational-leadership.jpg
supply-chain-executive-path,professional-skills,published,strategic,20,10,Supply Chain Executive Path,Supply Chain Executive Path,Tư duy của một lãnh đạo cấp cao. Cách nhìn nhận chuỗi cung ứng dưới góc độ tài chính và chiến lược để định vị bản thân lên các vị trí quản lý tầm cỡ.,The mindset of a senior leader. View the supply chain from a financial and strategic perspective to position yourself for major management roles.,"supply chain,lãnh đạo cấp cao,tài chính,chiến lược,career path",Hồ sơ năng lực cá nhân (Professional Portfolio) và lộ trình thăng tiến sự nghiệp.,A Personal Professional Portfolio and career advancement roadmap.,,,,,,,,,,Online / Hybrid,Online / Hybrid,/images/courses/supply-chain-executive-path.jpg
excel-vba-foundation-for-office-work,excel-vba-automation,published,foundation,10,4,Excel VBA Foundation for Office Work,Excel VBA Foundation for Office Work,"Khóa nền tảng cho người mới bắt đầu từ con số 0, giúp học viên hiểu bản chất VBA, ghi và tối ưu Macro, làm chủ cú pháp cơ bản để tự động hóa các thao tác Excel lặp lại trong công việc văn phòng.","A foundation course for complete beginners, helping learners understand VBA fundamentals, record and optimize macros, and master core syntax to automate repetitive Excel tasks in office work.","Excel VBA,macro,automation,data cleaning,dashboard,PDF","Macro format báo cáo, công cụ làm sạch dữ liệu và dashboard bán hàng cơ bản có thể cập nhật dữ liệu mới và xuất PDF.","A report-formatting macro, data cleaning tool, and basic sales dashboard that can refresh with new data and export to PDF.",0,,,"Nhân sự văn phòng thường xuyên xử lý báo cáo Excel thủ công|Nhân sự Sales, HR, Finance, Supply Chain cần làm sạch dữ liệu hệ thống|Người biết Excel cơ bản và muốn bắt đầu tự động hóa bằng VBA|Học viên cần nền tảng lập trình VBA trước khi học các bài toán đa file hoặc UserForm","Office staff who frequently process Excel reports manually|Sales, HR, Finance, and Supply Chain staff who need to clean system data|Learners with basic Excel skills who want to start automating with VBA|Learners who need VBA programming foundations before multi-file automation or UserForms","Làm quen VBA, Macro Recording và tư duy tự động hóa văn phòng|Cú pháp VBA cơ bản, Module, Sub và thao tác Range/Cells|Biến, kiểu dữ liệu, If...Then...Else, Select Case và xử lý dữ liệu thiếu hoặc sai định dạng|Vòng lặp For...Next, xác định dòng cuối động, cập nhật dashboard và xuất PDF","Introduction to VBA, Macro Recording, and office automation thinking|Core VBA syntax, Module, Sub, and Range/Cells operations|Variables, data types, If...Then...Else, Select Case, and handling missing or malformed data|For...Next loops, dynamic last-row detection, dashboard updates, and PDF export","Project 1: xây dựng tool tự động format báo cáo, làm sạch dữ liệu thô và xuất PDF hàng loạt từ file Excel thực hành.","Project 1: build a tool that automatically formats reports, cleans raw data, and exports PDF reports in bulk from practice Excel files.",Online Live Coding + Guided Practice,Online Live Coding + Guided Practice,/images/courses/course-excel-vba-foundation-for-office-work.webp
practical-automation-with-excel-vba,excel-vba-automation,published,application,15,6,Practical Automation with Excel VBA,Practical Automation with Excel VBA,"Khóa trung cấp giúp học viên tự động hóa các bài toán thực tế phức tạp hơn: gom dữ liệu từ nhiều file, đối chiếu số liệu, xây dựng UserForm nhập liệu và tạo tài liệu Word hoặc slide PowerPoint trực tiếp từ Excel.","An intermediate course for practical automation problems: consolidating data from multiple files, reconciling figures, building data-entry UserForms, and generating Word documents or PowerPoint slides directly from Excel.","Excel VBA,UserForm,multi-file import,reconciliation,Word automation,PowerPoint automation","Framework xử lý báo cáo, UserForm CRUD, công cụ gom dữ liệu đa file và bộ tạo tài liệu Word/PowerPoint tự động.","A reporting framework, CRUD UserForm, multi-file consolidation tool, and automated Word/PowerPoint document generator.",0,,excel-vba-foundation-for-office-work,"Học viên đã hoàn thành khóa VBA nền tảng|Người đã hiểu vòng lặp, điều kiện và Range/Cells trong VBA|Nhân sự cần gom báo cáo từ nhiều chi nhánh hoặc nhiều file Excel|Người muốn xây dựng form nhập liệu và tự động hóa báo cáo Office","Learners who have completed the VBA foundation course|Learners who understand loops, conditions, and Range/Cells in VBA|Staff who need to consolidate reports from multiple branches or Excel files|Learners who want to build data-entry forms and automate Office reports","Vòng lặp nâng cao, For Each, Do While và kỹ thuật xử lý chuỗi|Tương tác Workbook/Worksheet đa file, mở, đóng, lưu và copy dữ liệu động|Modular code, hàm tự tạo UDF, tái sử dụng Sub và debugging chủ động|Thiết kế UserForm với TextBox, ComboBox, CommandButton và validation dữ liệu|Multi-file Import bằng File System Object và đối chiếu dữ liệu giữa nhiều nguồn|Liên kết Excel với Word/PowerPoint, tạo hợp đồng, văn bản hoặc slide báo cáo từ template","Advanced loops, For Each, Do While, and string-processing techniques|Working with multiple Workbooks/Worksheets, opening, closing, saving, and dynamic data copy|Modular code, user-defined functions, reusable Subs, and proactive debugging|UserForm design with TextBox, ComboBox, CommandButton, and data validation|Multi-file import with File System Object and reconciliation across data sources|Connecting Excel with Word/PowerPoint to generate contracts, documents, or report slides from templates","Project 2: xây dựng tool tự động tổng hợp dữ liệu đa file, đối chiếu sai lệch và tạo báo cáo Word hoặc PowerPoint từ Excel.","Project 2: build a tool that consolidates multi-file data, reconciles discrepancies, and generates Word or PowerPoint reports from Excel.",Online Live Coding + Guided Practice,Online Live Coding + Guided Practice,/images/courses/course-practical-automation-with-excel-vba.webp
enterprise-automation-with-advanced-excel-vba,excel-vba-automation,published,advanced,20,8,Enterprise Automation with Advanced Excel VBA,Enterprise Automation with Advanced Excel VBA,"Khóa nâng cao tập trung vào xử lý dữ liệu lớn trên Excel bằng Arrays và Dictionary, tự động hóa Outlook/Word/PDF, xây dựng dashboard framework, kiểm thử UAT và đóng gói Add-in triển khai trong doanh nghiệp.","An advanced course focused on large-data processing in Excel with Arrays and Dictionary, Outlook/Word/PDF automation, dashboard frameworks, UAT testing, and packaging deployable business add-ins.","Excel VBA,arrays,dictionary,Outlook automation,dashboard,add-in,UAT","Hệ thống reporting cấp doanh nghiệp, hệ thống email/document automation và Excel Add-in thương mại có thể triển khai trên nhiều máy.","An enterprise reporting system, email/document automation system, and commercial Excel Add-in deployable across multiple machines.",0,,practical-automation-with-excel-vba,"Học viên đã hoàn thành khóa VBA trung cấp|Người đã thành thạo UserForm, xử lý file và tư duy lập trình logic|Nhân sự cần xử lý dữ liệu Excel lớn với hiệu năng cao|Người muốn đóng gói công cụ VBA thành Add-in dùng trong doanh nghiệp","Learners who have completed the intermediate VBA course|Learners proficient with UserForms, file handling, and logical programming|Staff who need high-performance processing for large Excel datasets|Learners who want to package VBA tools as business-ready Add-ins","VBA Arrays, mảng tĩnh, mảng động và xử lý dữ liệu trên RAM để tăng tốc hiệu năng|Dictionary Object, lọc trùng, tổng hợp đa điều kiện và thay thế các bài toán dò tìm phức tạp|Advanced UserForm, MultiPage, TabStrip, control nâng cao và Class Module cơ bản|Dashboard Framework tách Engine và View, tự động cập nhật PivotTable, PivotChart và Slicer|Automated Email & Document System với Outlook, PDF cá nhân hóa và gửi email theo điều kiện|Build Sprint có coaching để hoàn thiện Capstone Project, tối ưu UI và error logging|Kiểm thử UAT, bảo mật VBA Project và đóng gói Add-in .xlam|Final Demo, phản biện sản phẩm, nghiệm thu portfolio và định hướng roadmap sau khóa học","VBA Arrays, static and dynamic arrays, and in-memory data processing for performance gains|Dictionary Object, unique filtering, multi-condition aggregation, and alternatives to complex lookup problems|Advanced UserForms, MultiPage, TabStrip, advanced controls, and basic Class Modules|Dashboard Framework separating Engine and View, with automated PivotTable, PivotChart, and Slicer refresh|Automated Email & Document System with Outlook, personalized PDFs, and condition-based email sending|Coached Build Sprint to complete the Capstone Project, optimize UI, and add error logging|UAT testing, VBA Project protection, and packaging as an .xlam Add-in|Final Demo, product defense, portfolio review, and post-course learning roadmap","Capstone Project: hoàn thiện một hệ thống automation chạy ổn định, có kiểm thử UAT, ghi nhật ký lỗi và đóng gói thành Excel Add-in tùy biến trên Ribbon.","Capstone Project: complete a stable automation system with UAT testing, error logging, and packaging as a custom Excel Add-in on the Ribbon.",Online Live Coding + Guided Practice,Online Live Coding + Guided Practice,/images/courses/course-enterprise-automation-with-advanced-excel-vba.webp