slug,topic_slug,status,level,duration_hours,duration_sessions,title_vi,title_en,description_vi,description_en,tags,learning_outcome_vi,learning_outcome_en,price_original,price_sale,prerequisite,target_audience_vi,target_audience_en,modules_vi,modules_en,final_project_vi,final_project_en,delivery_format_vi,delivery_format_en,image_url
basic-prompt-engineering,ai-in-action,published,foundation,16,8,Basic Prompt Engineering,Basic Prompt Engineering,Làm chủ kỹ năng điều khiển AI thông qua ngôn ngữ. Tập trung vào việc tạo ra các 'câu lệnh vàng' để giải quyết nhanh các tác vụ văn phòng Logistics hàng ngày.,Master the skill of controlling AI through language. Focus on creating 'golden commands' to quickly resolve daily Logistics office tasks.,"prompt engineering,AI,logistics,ChatGPT,tự động hóa",Bộ thư viện Prompt chuẩn cho 20 tình huống Logistics phổ biến.,A standard Prompt library for 20 common Logistics scenarios.,,,,"Nhân viên điều phối, chứng từ và hành chính Logistics|Giám sát kho bãi, thu mua và quản lý hàng tồn kho|Chuyên viên chuỗi cung ứng muốn tự động hóa công việc hàng ngày|Nhân sự phi kỹ thuật muốn ứng dụng AI để tối ưu hóa hiệu suất","Nhân viên điều phối, chứng từ và hành chính Logistics|Giám sát kho bãi, thu mua và quản lý hàng tồn kho|Chuyên viên chuỗi cung ứng muốn tự động hóa công việc hàng ngày|Nhân sự phi kỹ thuật muốn ứng dụng AI để tối ưu hóa hiệu suất","Nền tảng về AI Tạo sinh (Generative AI) Hiểu cách AI tư duy và các nguyên tắc cốt lõi để ra lệnh hiệu quả.|Khung ""Câu lệnh Vàng"" (Golden Prompt) Học cách sử dụng cấu trúc chuẩn (Ngữ cảnh, Nhiệm vụ, Hướng dẫn, Đầu ra) để có kết quả chính xác.|Tự động hóa tác vụ Logistics hàng ngày Ứng dụng prompt vào việc soạn email, lên lịch trình và giao tiếp với nhà cung cấp.|Trích xuất và Tóm tắt Tài liệu Sử dụng AI để đọc nhanh và tóm tắt chứng từ hải quan, hợp đồng phức tạp.|Dự án cuối khóa Xây dựng thư viện câu lệnh (prompt) cá nhân hóa cho công việc của bạn.","Nền tảng về AI Tạo sinh (Generative AI) Hiểu cách AI tư duy và các nguyên tắc cốt lõi để ra lệnh hiệu quả.|Khung ""Câu lệnh Vàng"" (Golden Prompt) Học cách sử dụng cấu trúc chuẩn (Ngữ cảnh, Nhiệm vụ, Hướng dẫn, Đầu ra) để có kết quả chính xác.|Tự động hóa tác vụ Logistics hàng ngày Ứng dụng prompt vào việc soạn email, lên lịch trình và giao tiếp với nhà cung cấp.|Trích xuất và Tóm tắt Tài liệu Sử dụng AI để đọc nhanh và tóm tắt chứng từ hải quan, hợp đồng phức tạp.|Dự án cuối khóa Xây dựng thư viện câu lệnh (prompt) cá nhân hóa cho công việc của bạn.","Bạn sẽ làm việc với các tình huống Logistics thực tế hàng ngày để: - Xác định các tác vụ thủ công lặp đi lặp lại trong công việc hiện tại - Thiết kế, thử nghiệm và tinh chỉnh các prompt cho từng tác vụ","Bạn sẽ làm việc với các tình huống Logistics thực tế hàng ngày để: - Xác định các tác vụ thủ công lặp đi lặp lại trong công việc hiện tại - Thiết kế, thử nghiệm và tinh chỉnh các prompt cho từng tác vụ",Online / Hybrid,Online / Hybrid,/images/courses/basic-prompt-engineering.jpg
ai-driven-data-analysis,ai-in-action,published,tools,16,8,AI-Driven Data Analysis,AI-Driven Data Analysis,"Biến AI thành một 'Chuyên gia phân tích dữ liệu riêng'. Học cách tải dữ liệu vận hành lên AI để tìm lỗi, phân loại và vẽ biểu đồ xu hướng tự động.","Turn AI into a 'Personal Data Analysis Expert'. Learn how to upload operational data to AI to find errors, classify and automatically draw trend charts.","AI,phân tích dữ liệu,Excel,báo cáo,logistics",Báo cáo phân tích hiệu suất vận hành được thực hiện chỉ trong 5 phút.,An operational performance analysis report completed in just 5 minutes.,,,basic-prompt-engineering,"Chuyên viên phân tích nghiệp vụ (Business Analysts)|Quản lý Vận hành / Chuỗi cung ứng|Kỹ sư công nghiệp và sinh viên khối ngành kinh tế, Logistics|Nhân sự muốn chuyển đổi sang các vị trí phân tích dữ liệu","Chuyên viên phân tích nghiệp vụ (Business Analysts)|Quản lý Vận hành / Chuỗi cung ứng|Kỹ sư công nghiệp và sinh viên khối ngành kinh tế, Logistics|Nhân sự muốn chuyển đổi sang các vị trí phân tích dữ liệu","Tư duy Dữ liệu trong Vận hành Hiểu cách các doanh nghiệp logistics dùng dữ liệu để ra quyết định.|Chuẩn bị Dữ liệu cho AI Cách làm sạch và định dạng dữ liệu thô từ ERP/WMS để đưa vào AI.|AI - Chuyên gia phân tích của bạn Sử dụng tính năng phân tích nâng cao của ChatGPT để tìm lỗi và xu hướng.|Tự động hóa Trực quan hóa Dữ liệu (Data Visualization) Ra lệnh cho AI vẽ biểu đồ, đồ thị và các chỉ số đo lường hiệu suất (KPI) tức thì.|Dự án cuối khóa Áp dụng toàn bộ kiến thức vào một bộ dữ liệu Logistics thực tế.","Tư duy Dữ liệu trong Vận hành Hiểu cách các doanh nghiệp logistics dùng dữ liệu để ra quyết định.|Chuẩn bị Dữ liệu cho AI Cách làm sạch và định dạng dữ liệu thô từ ERP/WMS để đưa vào AI.|AI - Chuyên gia phân tích của bạn Sử dụng tính năng phân tích nâng cao của ChatGPT để tìm lỗi và xu hướng.|Tự động hóa Trực quan hóa Dữ liệu (Data Visualization) Ra lệnh cho AI vẽ biểu đồ, đồ thị và các chỉ số đo lường hiệu suất (KPI) tức thì.|Dự án cuối khóa Áp dụng toàn bộ kiến thức vào một bộ dữ liệu Logistics thực tế.",Bạn sẽ làm việc trên một bộ dữ liệu thực tế (vận hành logistics / kinh doanh) để: - Tải lên và làm sạch dữ liệu thô - Yêu cầu AI xác định các vấn đề hiệu suất cốt lõi,Bạn sẽ làm việc trên một bộ dữ liệu thực tế (vận hành logistics / kinh doanh) để: - Tải lên và làm sạch dữ liệu thô - Yêu cầu AI xác định các vấn đề hiệu suất cốt lõi,Online / Hybrid,Online / Hybrid,/images/courses/ai-driven-data-analysis.jpg
genai-in-scm-planning,ai-in-action,published,application,20,10,GenAI in Supply Chain Planning,GenAI in Supply Chain Planning,"Sử dụng AI để sáng tạo nội dung và giải pháp. Tập trung vào soạn thảo SOP, kịch bản điều phối vận tải và phương án ứng phó đứt gãy chuỗi cung ứng.","Use AI to create content and solutions. Focus on drafting SOPs, transport coordination scenarios and supply chain disruption response plans.","GenAI,SOP,supply chain,vận tải,contingency plan",Bộ quy trình SOP và kế hoạch dự phòng (Contingency Plan) chuẩn hóa.,A standardized SOP procedure set and Contingency Plan.,,,ai-driven-data-analysis,Chuyên viên Lập kế hoạch Chuỗi cung ứng (Supply Chain Planners)|Quản lý Vận hành và Giám đốc Kho bãi|Chuyên viên Thiết kế Giải pháp Logistics|Chuyên gia Cải tiến Liên tục (Continuous Improvement),Chuyên viên Lập kế hoạch Chuỗi cung ứng (Supply Chain Planners)|Quản lý Vận hành và Giám đốc Kho bãi|Chuyên viên Thiết kế Giải pháp Logistics|Chuyên gia Cải tiến Liên tục (Continuous Improvement),"Vai trò của GenAI trong Lập kế hoạch Vượt xa việc ""chat"" thông thường: Dùng AI để thiết kế chuỗi cung ứng.|AI thiết kế Quy trình Vận hành (SOP) Kỹ thuật tạo lập, tinh chỉnh và định dạng các SOP chi tiết một cách tự động.|Kịch bản Điều phối và Vận tải Dùng GenAI để xây dựng logic điều phối xe và quy tắc xếp dỡ hàng hóa.|Quản trị Rủi ro & Kế hoạch Dự phòng Mô phỏng các sự cố (đóng cửa cảng, nhà cung cấp phá sản) và tìm giải pháp với AI.|Dự án cuối khóa Phát triển một bộ cẩm nang vận hành toàn diện.","Vai trò của GenAI trong Lập kế hoạch Vượt xa việc ""chat"" thông thường: Dùng AI để thiết kế chuỗi cung ứng.|AI thiết kế Quy trình Vận hành (SOP) Kỹ thuật tạo lập, tinh chỉnh và định dạng các SOP chi tiết một cách tự động.|Kịch bản Điều phối và Vận tải Dùng GenAI để xây dựng logic điều phối xe và quy tắc xếp dỡ hàng hóa.|Quản trị Rủi ro & Kế hoạch Dự phòng Mô phỏng các sự cố (đóng cửa cảng, nhà cung cấp phá sản) và tìm giải pháp với AI.|Dự án cuối khóa Phát triển một bộ cẩm nang vận hành toàn diện.",Bạn sẽ giải quyết một cuộc khủng hoảng chuỗi cung ứng giả định để: - Viết mới một quy trình vận hành bằng GenAI - Đưa ra kịch bản phản ứng với sự cố đứt gãy Logistics,Bạn sẽ giải quyết một cuộc khủng hoảng chuỗi cung ứng giả định để: - Viết mới một quy trình vận hành bằng GenAI - Đưa ra kịch bản phản ứng với sự cố đứt gãy Logistics,Online / Hybrid,Online / Hybrid,/images/courses/genai-in-scm-planning.jpg
low-code-ai-agent-design,ai-in-action,published,advanced,24,12,Low-code AI Agent Design,Low-code AI Agent Design,"Tự thiết kế các 'Robot phần mềm' (AI Agents) am hiểu tài liệu riêng của công ty để hỗ trợ tra cứu chính sách hải quan, quy định kho bãi hoặc trả lời khách hàng 24/7.","Design your own 'Software Robots' (AI Agents) that understand your company's documents to support 24/7 customs policy lookup, warehouse regulations or customer service.","AI agent,low-code,ChatGPT,Zapier,tự động hóa,chatbot",Một Custom AI Agent hoạt động thực tế trên nền tảng như ChatGPT hoặc Zapier.,A fully functional Custom AI Agent deployed on platforms like ChatGPT or Zapier.,,,genai-in-scm-planning,Chuyên viên IT Logistics và Hệ thống vận hành|Giám đốc Vận hành đang tìm kiếm giải pháp tự động hóa nội bộ|Quản lý Chăm sóc Khách hàng Logistics (Customer Service)|Nhân sự yêu thích công nghệ muốn tạo ra đột phá tại công ty,Chuyên viên IT Logistics và Hệ thống vận hành|Giám đốc Vận hành đang tìm kiếm giải pháp tự động hóa nội bộ|Quản lý Chăm sóc Khách hàng Logistics (Customer Service)|Nhân sự yêu thích công nghệ muốn tạo ra đột phá tại công ty,"Giới thiệu về Custom AI Agents Phân biệt AI công cộng (Public AI) và Trợ lý AI cá nhân hóa được huấn luyện riêng.|Xây dựng Cơ sở Tri thức (Knowledge Bases) Cách chuẩn bị file PDF, SOP, thông tư hải quan để nạp vào AI.|Thiết kế Custom GPT đầu tiên của bạn Thực hành cấu hình một Trợ lý AI chuyên biệt cho một tác vụ Logistics.|Tích hợp Low-code với Zapier Kết nối AI Agent với Email, Slack hoặc hệ thống ERP mà không cần biết lập trình.|Dự án cuối khóa Hoàn thiện và đưa trợ lý AI vào hoạt động thực tế.","Giới thiệu về Custom AI Agents Phân biệt AI công cộng (Public AI) và Trợ lý AI cá nhân hóa được huấn luyện riêng.|Xây dựng Cơ sở Tri thức (Knowledge Bases) Cách chuẩn bị file PDF, SOP, thông tư hải quan để nạp vào AI.|Thiết kế Custom GPT đầu tiên của bạn Thực hành cấu hình một Trợ lý AI chuyên biệt cho một tác vụ Logistics.|Tích hợp Low-code với Zapier Kết nối AI Agent với Email, Slack hoặc hệ thống ERP mà không cần biết lập trình.|Dự án cuối khóa Hoàn thiện và đưa trợ lý AI vào hoạt động thực tế.","Bạn sẽ sử dụng các nền tảng low-code (như ChatGPT Plus hoặc Zapier) để: - Định nghĩa bài toán (VD: Bot tra cứu chính sách Hải quan, Bot kiểm tra đơn hàng) - Nạp tài liệu chuyên ngành vào hệ thống","Bạn sẽ sử dụng các nền tảng low-code (như ChatGPT Plus hoặc Zapier) để: - Định nghĩa bài toán (VD: Bot tra cứu chính sách Hải quan, Bot kiểm tra đơn hàng) - Nạp tài liệu chuyên ngành vào hệ thống",Online / Hybrid,Online / Hybrid,/images/courses/low-code-ai-agent-design.jpg
ai-strategic-leadership,ai-in-action,published,strategic,20,10,AI Strategic Leadership,AI Strategic Leadership,"Dành cho nhà quản lý để hoạch định tương lai. Tập trung vào quản trị sự thay đổi, bảo mật thông tin doanh nghiệp khi dùng AI và đo lường hiệu quả AI trong vận hành.","For managers to plan the future. Focus on change management, corporate information security when using AI and measuring AI effectiveness in operations.","AI governance,chiến lược,quản lý,roadmap,bảo mật",Bản lộ trình (Roadmap) triển khai AI cho đơn vị/doanh nghiệp.,An AI implementation Roadmap for your department/organization.,,,,"Lãnh đạo cấp cao (C-Level) và Giám đốc Chuỗi cung ứng|Giám đốc Chuyển đổi số (Digital Transformation Managers)|Trưởng phòng ban (Vận hành, Kho bãi, Thu mua, Xuất nhập khẩu)|Quản lý dự án dẫn dắt việc áp dụng công nghệ mới","Lãnh đạo cấp cao (C-Level) và Giám đốc Chuỗi cung ứng|Giám đốc Chuyển đổi số (Digital Transformation Managers)|Trưởng phòng ban (Vận hành, Kho bãi, Thu mua, Xuất nhập khẩu)|Quản lý dự án dẫn dắt việc áp dụng công nghệ mới","Tầm nhìn Lãnh đạo về AI trong Chuỗi cung ứng Bức tranh toàn cảnh, phân biệt ""thực tế"" và ""trào lưu"", xác định lợi thế cạnh tranh.|Quản trị Rủi ro & Bảo mật Dữ liệu AI Thiết lập quy tắc nội bộ để bảo vệ tài sản trí tuệ và đảm bảo dùng AI đạo đức.|Quản trị Sự thay đổi trong Doanh nghiệp Chiến lược vượt qua sức ỳ của nhân viên và xây dựng văn hóa công ty cởi mở với AI.|Đo lường Hiệu quả (ROI) & KPIs của AI Cách tính toán chi phí, lợi ích và đánh giá mức độ thành công của dự án công nghệ.","Tầm nhìn Lãnh đạo về AI trong Chuỗi cung ứng Bức tranh toàn cảnh, phân biệt ""thực tế"" và ""trào lưu"", xác định lợi thế cạnh tranh.|Quản trị Rủi ro & Bảo mật Dữ liệu AI Thiết lập quy tắc nội bộ để bảo vệ tài sản trí tuệ và đảm bảo dùng AI đạo đức.|Quản trị Sự thay đổi trong Doanh nghiệp Chiến lược vượt qua sức ỳ của nhân viên và xây dựng văn hóa công ty cởi mở với AI.|Đo lường Hiệu quả (ROI) & KPIs của AI Cách tính toán chi phí, lợi ích và đánh giá mức độ thành công của dự án công nghệ.",Bạn sẽ phân tích mức độ trưởng thành số của doanh nghiệp mình để: - Nhận diện các điểm nóng có thể ứng dụng AI để mang lại hiệu quả ngay - Soạn thảo quy tắc bảo mật dữ liệu khi dùng AI cho nhân viên,Bạn sẽ phân tích mức độ trưởng thành số của doanh nghiệp mình để: - Nhận diện các điểm nóng có thể ứng dụng AI để mang lại hiệu quả ngay - Soạn thảo quy tắc bảo mật dữ liệu khi dùng AI cho nhân viên,Online / Hybrid,Online / Hybrid,/images/courses/ai-strategic-leadership.jpg
lean-thinking-4,quality-management,published,foundation,16,8,Lean Thinking 4.0,Lean Thinking 4.0,Loại bỏ lãng phí và tối ưu hóa dòng chảy giá trị. Tập trung tinh gọn hóa quy trình từ kho bãi đến sản xuất bằng công nghệ số.,Eliminate waste and optimize value flow. Focus on streamlining processes from warehousing to production using digital technology.,"lean,VSM,tinh gọn,kho bãi,sản xuất",Bản sơ đồ chuỗi giá trị (VSM) hiện tại và tương lai của doanh nghiệp.,A current and future Value Stream Map (VSM) for your organization.,,,,"Quản lý sản xuất, Giám đốc nhà máy và Quản lý kho bãi|Chuyên viên Cải tiến liên tục (Continuous Improvement / Lean Engineer)|Kỹ sư hệ thống công nghiệp và Kỹ sư vận hành|Quản lý cấp trung muốn chuẩn hóa và số hóa quy trình làm việc","Quản lý sản xuất, Giám đốc nhà máy và Quản lý kho bãi|Chuyên viên Cải tiến liên tục (Continuous Improvement / Lean Engineer)|Kỹ sư hệ thống công nghiệp và Kỹ sư vận hành|Quản lý cấp trung muốn chuẩn hóa và số hóa quy trình làm việc","Nền tảng Lean trong Kỷ nguyên 4.0 Tư duy tinh gọn hiện đại: Kết nối triết lý Lean với dữ liệu và công nghệ.|Nhận diện Lãng phí & Công cụ Lean cơ bản Phân tích lãng phí thực tế, triển khai 5S và Quản lý trực quan (Visual Management) kỹ thuật số.|Lập bản đồ Chuỗi giá trị (VSM) Kỹ thuật vẽ VSM hiện tại (Current State) và thiết kế VSM tương lai (Future State).|Kéo, Chảy & JIT (Just-In-Time) Thiết lập luồng công việc liên tục, hệ thống Kanban số và tối ưu hóa thời gian chu kỳ.|Dự án cuối khóa Hoàn thiện dự án tinh gọn quy trình thực tế tại doanh nghiệp của bạn.","Nền tảng Lean trong Kỷ nguyên 4.0 Tư duy tinh gọn hiện đại: Kết nối triết lý Lean với dữ liệu và công nghệ.|Nhận diện Lãng phí & Công cụ Lean cơ bản Phân tích lãng phí thực tế, triển khai 5S và Quản lý trực quan (Visual Management) kỹ thuật số.|Lập bản đồ Chuỗi giá trị (VSM) Kỹ thuật vẽ VSM hiện tại (Current State) và thiết kế VSM tương lai (Future State).|Kéo, Chảy & JIT (Just-In-Time) Thiết lập luồng công việc liên tục, hệ thống Kanban số và tối ưu hóa thời gian chu kỳ.|Dự án cuối khóa Hoàn thiện dự án tinh gọn quy trình thực tế tại doanh nghiệp của bạn.",Bạn sẽ áp dụng kiến thức vào một quy trình (sản xuất hoặc kho bãi) đang gặp vấn đề tại công ty để: - Phân tích hiện trạng luồng di chuyển của vật tư và thông tin - Xác định các nút thắt (bottlenecks) và thời gian lãng phí,Bạn sẽ áp dụng kiến thức vào một quy trình (sản xuất hoặc kho bãi) đang gặp vấn đề tại công ty để: - Phân tích hiện trạng luồng di chuyển của vật tư và thông tin - Xác định các nút thắt (bottlenecks) và thời gian lãng phí,Online / Hybrid,Online / Hybrid,/images/courses/lean-thinking-4.jpg
six-sigma-green-belt,quality-management,published,tools,24,12,Six Sigma Green Belt,Six Sigma Green Belt,Phương pháp luận giải quyết vấn đề dựa trên dữ liệu (DMAIC). Giúp giảm tỷ lệ sai sót và biến động trong mọi quy trình vận hành.,Data-driven problem-solving methodology (DMAIC). Helps reduce error rates and variation in all operational processes.,"six sigma,DMAIC,dữ liệu,cải tiến,green belt",01 Dự án cải tiến thực tế giúp tiết kiệm chi phí hoặc thời gian cho công ty.,01 real improvement project that saves cost or time for the company.,,,lean-thinking-4,"Chuyên viên Đảm bảo/Kiểm soát Chất lượng (QA/QC)|Kỹ sư Cải tiến quy trình, Kỹ sư Công nghiệp|Quản lý vận hành cấp trung đang tìm kiếm công cụ để giảm chi phí lỗi|Nhân sự muốn đạt chứng nhận Six Sigma để thăng tiến trong khối sản xuất/FDI","Chuyên viên Đảm bảo/Kiểm soát Chất lượng (QA/QC)|Kỹ sư Cải tiến quy trình, Kỹ sư Công nghiệp|Quản lý vận hành cấp trung đang tìm kiếm công cụ để giảm chi phí lỗi|Nhân sự muốn đạt chứng nhận Six Sigma để thăng tiến trong khối sản xuất/FDI","Define (Xác định) & Measure (Đo lường) Lập điều lệ dự án (Project Charter), thu thập dữ liệu và đánh giá năng lực hiện tại.|Phân tích Thống kê Cơ bản Làm quen với các khái niệm thống kê ứng dụng và phần mềm phân tích.|Analyze (Phân tích) Tìm nguyên nhân gốc rễ bằng biểu đồ Ishikawa, 5 Whys và kiểm định giả thuyết.|Improve (Cải tiến) & Control (Kiểm soát) Lựa chọn giải pháp tối ưu và thiết lập cơ chế kiểm soát không để lỗi tái diễn.|Dự án cuối khóa Hoàn thành và bảo vệ dự án Six Sigma thực tế tại doanh nghiệp.","Define (Xác định) & Measure (Đo lường) Lập điều lệ dự án (Project Charter), thu thập dữ liệu và đánh giá năng lực hiện tại.|Phân tích Thống kê Cơ bản Làm quen với các khái niệm thống kê ứng dụng và phần mềm phân tích.|Analyze (Phân tích) Tìm nguyên nhân gốc rễ bằng biểu đồ Ishikawa, 5 Whys và kiểm định giả thuyết.|Improve (Cải tiến) & Control (Kiểm soát) Lựa chọn giải pháp tối ưu và thiết lập cơ chế kiểm soát không để lỗi tái diễn.|Dự án cuối khóa Hoàn thành và bảo vệ dự án Six Sigma thực tế tại doanh nghiệp.",Bạn sẽ phải thực hiện một bài toán giải quyết vấn đề xuyên suốt khóa học (có dữ liệu thật từ công ty bạn) để: - Đo lường mức độ lỗi hiện tại của một dây chuyền hoặc quy trình dịch vụ - Phân tích và tìm ra 1-2 nguyên nhân cốt lõi bằng số liệu,Bạn sẽ phải thực hiện một bài toán giải quyết vấn đề xuyên suốt khóa học (có dữ liệu thật từ công ty bạn) để: - Đo lường mức độ lỗi hiện tại của một dây chuyền hoặc quy trình dịch vụ - Phân tích và tìm ra 1-2 nguyên nhân cốt lõi bằng số liệu,Online / Hybrid,Online / Hybrid,/images/courses/six-sigma-green-belt.jpg
applied-spc,quality-management,published,application,20,10,Applied SPC,Applied SPC,Kiểm soát quy trình bằng thống kê thực chiến. Sử dụng phần mềm Minitab/Excel để giám sát và cảnh báo sớm các nguy cơ về chất lượng.,Process control through practical statistics. Use Minitab/Excel software to monitor and provide early warning of quality risks.,"SPC,thống kê,Minitab,control chart,chất lượng",Hệ thống biểu đồ kiểm soát (Control Charts) cho các chỉ số quan trọng (KPIs).,A Control Chart system for key performance indicators (KPIs).,,,six-sigma-green-belt,Kỹ sư Chất lượng (Quality Engineers) và Giám sát QC|Kỹ sư Vận hành dây chuyền sản xuất|Chuyên viên phân tích dữ liệu sản xuất|Quản lý nhà máy cần hệ thống cảnh báo sớm (Early Warning System),Kỹ sư Chất lượng (Quality Engineers) và Giám sát QC|Kỹ sư Vận hành dây chuyền sản xuất|Chuyên viên phân tích dữ liệu sản xuất|Quản lý nhà máy cần hệ thống cảnh báo sớm (Early Warning System),"Bản chất của Biến động (Variation) Tư duy thống kê trong kiểm soát chất lượng và nhận diện sai số.|Biểu đồ kiểm soát cho Dữ liệu liên tục (Variables) Cách vẽ và phân tích biểu đồ X-bar R, X-bar S, I-MR bằng phần mềm.|Biểu đồ kiểm soát cho Dữ liệu rời rạc (Attributes) Cách vẽ và phân tích biểu đồ p, np, c, u cho các lỗi ngoại quan, đếm khuyết tật.|Đánh giá Năng lực Quy trình (Process Capability) Tính toán và giải nghĩa các chỉ số Cp, Cpk, Pp, Ppk để báo cáo khách hàng.|Dự án cuối khóa Thiết lập hệ thống SPC áp dụng trực tiếp cho một công đoạn tại xưởng.","Bản chất của Biến động (Variation) Tư duy thống kê trong kiểm soát chất lượng và nhận diện sai số.|Biểu đồ kiểm soát cho Dữ liệu liên tục (Variables) Cách vẽ và phân tích biểu đồ X-bar R, X-bar S, I-MR bằng phần mềm.|Biểu đồ kiểm soát cho Dữ liệu rời rạc (Attributes) Cách vẽ và phân tích biểu đồ p, np, c, u cho các lỗi ngoại quan, đếm khuyết tật.|Đánh giá Năng lực Quy trình (Process Capability) Tính toán và giải nghĩa các chỉ số Cp, Cpk, Pp, Ppk để báo cáo khách hàng.|Dự án cuối khóa Thiết lập hệ thống SPC áp dụng trực tiếp cho một công đoạn tại xưởng.","Bạn sẽ sử dụng thông số thu thập từ một trạm làm việc (máy móc, trạm đóng gói, v.v.) để: - Chọn loại biểu đồ SPC phù hợp nhất với dữ liệu - Tính toán các giới hạn kiểm soát trên và dưới (UCL/LCL)","Bạn sẽ sử dụng thông số thu thập từ một trạm làm việc (máy móc, trạm đóng gói, v.v.) để: - Chọn loại biểu đồ SPC phù hợp nhất với dữ liệu - Tính toán các giới hạn kiểm soát trên và dưới (UCL/LCL)",Online / Hybrid,Online / Hybrid,/images/courses/applied-spc.jpg
